{
  "version": "0.1.0",
  "last_updated": "2026-08-04",
  "status": "developing_doctrine_architecture",
  "decision_ids": ["CC-DEC-050", "CC-DEC-051"],
  "domain_title": "Constitutional Transparency and the People's Ledger",
  "research_domain_title": "Constitutional Transparency, Public Records, and Accountability Systems",
  "website_node_id": "CC-WEB-TRANSPARENCY",
  "note": "Fourth institutional spine. Architecture and developing doctrine only — not a finished open-records statute. Presumption of openness with legitimate exceptions. No invented FOIA statistics or portal coverage claims.",
  "role_in_philosophy": "Constitutional transparency is not the claim that everything government does is public. It is a presumption of openness with constitutionally and legally justified exceptions, so power remains reviewable while privacy, safety, and national security remain protected.",
  "guiding_principle": {
    "text": "In a constitutional republic, government does not own public information. It holds public information in trust for the people, subject only to those limited protections necessary to preserve constitutional rights, legitimate privacy, public safety, and national security.",
    "doctrine_ids": ["CC-DEV-029", "CC-DEV-030"]
  },
  "openness_presumption": {
    "text": "Government information created with public resources should be presumed open unless there is a constitutionally or legally justified reason to protect it. The burden should generally be on the government to explain why information is withheld.",
    "doctrine_ids": ["CC-DEV-029"]
  },
  "legitimate_exceptions_examples": [
    "classified national security information",
    "active criminal investigations",
    "certain personal records",
    "protected health information",
    "trade secrets submitted under law",
    "other information whose disclosure could violate privacy or create serious safety risks"
  ],
  "exceptions_rule": "Exceptions must be grounded in law, narrowly tailored, explained, and subject to review. Secrecy is not the default.",
  "digital_trail_doctrine": {
    "summary": "Every government action should leave a digital trail so the public can see what happened, who authorized it, why it happened, how much it cost, what outcome was expected, and whether it succeeded.",
    "covers": [
      "expenditures",
      "votes",
      "contracts",
      "grants",
      "regulations",
      "meetings",
      "studies",
      "audits",
      "permits",
      "major decisions",
      "publicly funded projects"
    ],
    "public_should_see": [
      "what happened",
      "who authorized it",
      "why it happened",
      "how much it cost",
      "what the expected outcome was",
      "whether it succeeded"
    ],
    "doctrine_ids": ["CC-DEV-031"]
  },
  "peoples_ledger": {
    "name": "The People's Ledger",
    "definition": "Not a financial ledger alone — a constitutional accountability ledger: a searchable portal where every public dollar and major public action has a traceable story.",
    "example_path": [
      "Arkansas Department of Transportation",
      "Bridge Project",
      "County",
      "Funding source",
      "Engineering contract",
      "Bid documents",
      "Winning proposal",
      "Change orders",
      "Payments made",
      "Construction photos",
      "Inspection reports",
      "Completion status",
      "Final audit",
      "Performance after five years"
    ],
    "status": "design_agenda",
    "note": "Named instrument and architecture — not an operating statewide portal. Do not invent coverage statistics.",
    "doctrine_ids": ["CC-DEV-031"]
  },
  "public_dashboard": {
    "summary": "Every agency should publish a living accountability page — not a press-release page — that ordinary citizens can understand.",
    "fields": [
      "Mission",
      "Budget",
      "Employees",
      "Programs",
      "Current projects",
      "Contracts",
      "Performance",
      "Wait times",
      "Audits",
      "Open recommendations",
      "Public complaints",
      "Responses",
      "Improvement plans"
    ],
    "rule": "Citizens should not need specialized knowledge to understand how an agency is performing."
  },
  "traceable_law": {
    "summary": "Every statute should be selectable with its full public history, not only the final text.",
    "fields": [
      "Who introduced it",
      "Committee hearings",
      "Public testimony",
      "Amendments",
      "Votes",
      "Fiscal impact",
      "Constitutional analysis",
      "Implementation timeline",
      "Agencies responsible",
      "Administrative rules created",
      "Current performance",
      "Court decisions interpreting it",
      "Sunset review date"
    ]
  },
  "public_procurement": {
    "summary": "Every contract should be searchable, subject to legitimate confidentiality protections where required by law.",
    "fields": [
      "contractor",
      "amount",
      "procurement method",
      "competing bids",
      "evaluation criteria",
      "award justification",
      "milestones",
      "payments",
      "amendments",
      "completion",
      "audit findings"
    ]
  },
  "boards_and_commissions_publication": [
    "meeting agendas",
    "recordings where appropriate",
    "attendance",
    "votes",
    "minutes",
    "current membership",
    "appointments",
    "vacancies",
    "ethics disclosures where required",
    "active projects",
    "performance indicators"
  ],
  "open_budgets": {
    "requirements": [
      "Plain-language budgets",
      "Interactive budgets",
      "Department budgets",
      "Program budgets",
      "Project budgets",
      "County budgets",
      "School budgets",
      "Historical comparisons",
      "Per-capita spending",
      "Budget explanations",
      "Actual spending versus planned spending"
    ],
    "rule": "The public should be able to follow a dollar from appropriation to expenditure."
  },
  "ai_for_transparency": {
    "rule": "AI should help citizens understand government — not replace government or become the official record.",
    "role": "Interpreter of public records",
    "records_remain_official": true,
    "example_queries": [
      "Show me every transportation project in my county over the last five years.",
      "Which agencies spent the most on outside consultants?",
      "How many contracts were completed on time?"
    ],
    "doctrine_ids": ["CC-DEV-032", "CC-DEV-028"]
  },
  "public_access_equity": {
    "summary": "Transparency must not depend on whether someone owns a computer or has reliable internet.",
    "free_access": true,
    "terminal_locations_examples": [
      "libraries",
      "county courthouses",
      "city halls",
      "state offices"
    ],
    "doctrine_ids": ["CC-DEV-032"]
  },
  "identity_and_access_balance": {
    "caution": "Requiring identity disclosure for routine viewing of ordinary public records can chill journalists, whistleblowers, business owners, activists, and curious citizens.",
    "routine_public_records": "Freely accessible without unnecessary barriers, while protecting systems against abuse through reasonable cybersecurity measures.",
    "sensitive_or_high_volume": "Authentication, rate limits, or licensing where needed to protect security, privacy, or system integrity.",
    "actions_that_change_records": "Always authenticated and fully audited.",
    "doctrine_ids": ["CC-DEV-032"]
  },
  "constitutional_transparency_test": {
    "title": "Constitutional Transparency Test",
    "purpose": "Screen transparency, records, procurement, and accountability reforms before acceptance into the framework.",
    "questions": [
      {
        "question_id": "CC-TTEST-01",
        "number": 1,
        "text": "Is this funded with public money?"
      },
      {
        "question_id": "CC-TTEST-02",
        "number": 2,
        "text": "What legal authority authorizes it?"
      },
      {
        "question_id": "CC-TTEST-03",
        "number": 3,
        "text": "Can the public understand its purpose?"
      },
      {
        "question_id": "CC-TTEST-04",
        "number": 4,
        "text": "Can the public measure its success?"
      },
      {
        "question_id": "CC-TTEST-05",
        "number": 5,
        "text": "Can the public review how money was spent?"
      },
      {
        "question_id": "CC-TTEST-06",
        "number": 6,
        "text": "Can the public challenge errors?"
      },
      {
        "question_id": "CC-TTEST-07",
        "number": 7,
        "text": "Is any information withheld? If so, why?"
      },
      {
        "question_id": "CC-TTEST-08",
        "number": 8,
        "text": "Is the reason for withholding grounded in law and subject to review?"
      },
      {
        "question_id": "CC-TTEST-09",
        "number": 9,
        "text": "Is there an independent audit trail?"
      },
      {
        "question_id": "CC-TTEST-10",
        "number": 10,
        "text": "Can future generations understand what happened and why?"
      }
    ]
  },
  "website_branches": [
    { "branch_id": "CC-TRN-B01", "title": "Presumption of openness" },
    { "branch_id": "CC-TRN-B02", "title": "Legitimate exceptions" },
    { "branch_id": "CC-TRN-B03", "title": "The People's Ledger" },
    { "branch_id": "CC-TRN-B04", "title": "Agency public dashboards" },
    { "branch_id": "CC-TRN-B05", "title": "Traceable statutes" },
    { "branch_id": "CC-TRN-B06", "title": "Open procurement" },
    { "branch_id": "CC-TRN-B07", "title": "Open budgets" },
    { "branch_id": "CC-TRN-B08", "title": "Board and commission records" },
    { "branch_id": "CC-TRN-B09", "title": "Public-access terminals" },
    { "branch_id": "CC-TRN-B10", "title": "Identity and access balance" },
    { "branch_id": "CC-TRN-B11", "title": "AI as records interpreter" },
    { "branch_id": "CC-TRN-B12", "title": "Audit trails and independent review" },
    { "branch_id": "CC-TRN-B13", "title": "Privacy and public safety protections" },